{
  "worktree": "operational_epistemic_vocabulary",
  "version": "2.1A",
  "chain": [
    "epistemic_zero",
    "attention",
    "distinction",
    "designation",
    "identity",
    "universal",
    "particular",
    "domain",
    "aspect",
    "temporal_scope",
    "judgment_rank",
    "contradiction_check",
    "linking",
    "interpretation",
    "conception",
    "judgment"
  ],
  "final_epistemic_judgments": [
    "ZERO",
    "HYPOTHESIS",
    "CERTIFICATE"
  ],
  "nodes": [
    {
      "node_id": "epistemic_zero",
      "rank": 1,
      "definition": "Alert that a present signal in awareness is not yet determined knowledge (plain: x is in awareness but not in determined knowledge).",
      "mathematical_form": "Z0(x)=1 ⇔ x∈Awareness ∧ x∉DeterminedKnowledge",
      "programming_contract": "EpistemicZero(zero_id, signal_ref, reason, awareness_present, knowledge_determined, residuals)",
      "linguistic_function": "Marks unknown presence and preserves it for governed processing.",
      "required_inputs": ["awareness_signal"],
      "outputs": ["zero_alert"],
      "forbidden_transitions": ["residual_erasure", "silent_level_skip"],
      "residuals": ["unknown_signal", "unresolved_unit", "missing_prior_information"],
      "next_nodes": ["attention"]
    },
    {
      "node_id": "attention",
      "rank": 2,
      "definition": "Selection of a specific epistemic-zero signal for active processing.",
      "mathematical_form": "A(x)=select(x|Z0(x), salience, urgency, relevance)",
      "programming_contract": "AttentionEvent(event_id, zero_id, selected_signal, salience_score, urgency_score, relevance_score, reason, residuals)",
      "linguistic_function": "Moves from generic alert to explicit processing commitment.",
      "required_inputs": ["zero_alert"],
      "outputs": ["attended_signal"],
      "forbidden_transitions": ["attention_without_zero", "silent_level_skip"],
      "residuals": ["attention_queue_overload", "low_relevance_signal"],
      "next_nodes": ["distinction"]
    },
    {
      "node_id": "distinction",
      "rank": 3,
      "definition": "Separation of a unit from background so it can be processed.",
      "mathematical_form": "D(x,b)=unit(x) where x is separated from background b",
      "programming_contract": "DistinctionUnit(unit_id, source_signal, raw_span, boundary, distinct_from, confidence, residuals)",
      "linguistic_function": "Segments lexical or semantic units before assignment.",
      "required_inputs": ["attended_signal"],
      "outputs": ["distinguished_unit"],
      "forbidden_transitions": ["designation_without_distinction", "silent_level_skip"],
      "residuals": ["unclear_boundary", "overlapping_units", "unsegmented_input"],
      "next_nodes": ["designation"]
    },
    {
      "node_id": "designation",
      "rank": 4,
      "definition": "Assignment of type/reference/function to a distinguished unit.",
      "mathematical_form": "G(u)=assign(u→type/reference/function/domain)",
      "programming_contract": "DesignationUnit(designation_id, distinguished_unit_id, assigned_type, assigned_identity, assigned_reference, assigned_function, assignment_basis, confidence, residuals)",
      "linguistic_function": "Assigns grammatical-semantic role to segmented unit.",
      "required_inputs": ["distinguished_unit"],
      "outputs": ["designated_unit"],
      "forbidden_transitions": ["designation_without_distinction", "domain_without_designation"],
      "residuals": ["ambiguous_assignment", "unknown_type", "unresolved_reference"],
      "next_nodes": ["identity", "domain"]
    },
    {
      "node_id": "identity",
      "rank": 5,
      "definition": "Continuity of a designated unit across context, reference, and time.",
      "mathematical_form": "ID(x1)=ID(x2) under a valid continuity path",
      "programming_contract": "IdentityUnit(identity_id, mentions, reference_type, continuity_scope, temporal_scope, identity_basis, confidence, residuals)",
      "linguistic_function": "Resolves pronouns/coreference and continuity claims.",
      "required_inputs": ["designated_unit"],
      "outputs": ["identity_resolved_unit"],
      "forbidden_transitions": ["judgment_without_identity_resolution", "silent_level_skip"],
      "residuals": ["identity_shift", "homonym_confusion", "temporal_identity_gap"],
      "next_nodes": ["universal", "particular"]
    },
    {
      "node_id": "universal",
      "rank": 6,
      "definition": "A concept that can be predicated of many instances.",
      "mathematical_form": "Universal(U) ⇔ ∃x,y,z : U applies to x,y,z",
      "programming_contract": "UniversalConcept(concept_id, label, applies_to_many, necessary_features, accidental_features, domain, scope, residuals)",
      "linguistic_function": "Represents category-level meaning.",
      "required_inputs": ["identity_resolved_unit"],
      "outputs": ["universal_concept"],
      "forbidden_transitions": ["universal_to_particular_without_applicability"],
      "residuals": ["overgeneralized_universal", "missing_applicability_conditions"],
      "next_nodes": ["domain"]
    },
    {
      "node_id": "particular",
      "rank": 7,
      "definition": "A determinate singular referent not predicable of many the same way.",
      "mathematical_form": "Particular(p) ⇔ ¬applies_to_many(p)",
      "programming_contract": "ParticularUnit(particular_id, reference, designation_id, time_scope, place_scope, identity_unit_id, residuals)",
      "linguistic_function": "Anchors claim subject to concrete referent.",
      "required_inputs": ["identity_resolved_unit"],
      "outputs": ["particular_subject"],
      "forbidden_transitions": ["judgment_without_subject"],
      "residuals": ["unresolved_particular_reference", "missing_context_scope"],
      "next_nodes": ["domain"]
    },
    {
      "node_id": "domain",
      "rank": 8,
      "definition": "Scope where meaning, evidence, and judgment are valid.",
      "mathematical_form": "DM(x)=domain in which x is validly interpreted",
      "programming_contract": "DomainAssignment(domain_id, unit_id, domain, assignment_basis, allowed_evidence_types, forbidden_transfers, confidence, residuals)",
      "linguistic_function": "Prevents invalid transfer between linguistic, legal, empirical, and metaphorical scopes.",
      "required_inputs": ["designated_unit"],
      "outputs": ["domain_assignment"],
      "forbidden_transitions": ["domain_without_designation", "domain_transfer_without_bridge", "contradiction_without_domain"],
      "residuals": ["domain_unresolved", "cross_domain_leakage"],
      "next_nodes": ["aspect", "temporal_scope", "judgment_rank"]
    },
    {
      "node_id": "aspect",
      "rank": 9,
      "definition": "Angle of predication such as potential/actual or literal/metaphorical.",
      "mathematical_form": "ASP(c)=aspect(c)",
      "programming_contract": "AspectScope(aspect_id, claim_id, aspect_type, description, residuals)",
      "linguistic_function": "Distinguishes different predication modes that avoid false contradiction.",
      "required_inputs": ["domain_assignment"],
      "outputs": ["aspect_scope"],
      "forbidden_transitions": ["contradiction_without_aspect"],
      "residuals": ["aspect_unresolved", "aspect_conflict"],
      "next_nodes": ["contradiction_check"]
    },
    {
      "node_id": "temporal_scope",
      "rank": 10,
      "definition": "Time bounds in which a claim remains valid.",
      "mathematical_form": "T(c)=validity_interval(c)",
      "programming_contract": "TemporalScope(time_scope_id, claim_id, start, end, tense, validity, residuals)",
      "linguistic_function": "Distinguishes past/present/future and interval-dependent claims.",
      "required_inputs": ["domain_assignment"],
      "outputs": ["time_scope"],
      "forbidden_transitions": ["contradiction_without_time"],
      "residuals": ["time_scope_missing", "temporal_conflict"],
      "next_nodes": ["contradiction_check"]
    },
    {
      "node_id": "judgment_rank",
      "rank": 11,
      "definition": "Epistemic rank of a claim (question, hypothesis, analysis, factual claim, certificate candidate).",
      "mathematical_form": "JR(c)=rank(c)",
      "programming_contract": "JudgmentRank(rank_id, claim_id, rank, allowed_final_judgment, residuals)",
      "linguistic_function": "Aligns statement force before contradiction and final judgment checks.",
      "required_inputs": ["domain_assignment"],
      "outputs": ["rank_assignment"],
      "forbidden_transitions": ["contradiction_without_judgment_rank"],
      "residuals": ["rank_unaligned", "rank_unresolved"],
      "next_nodes": ["contradiction_check"]
    },
    {
      "node_id": "contradiction_check",
      "rank": 12,
      "definition": "Checks contradiction only after same subject/predicate/meaning/domain/time/aspect/rank are resolved.",
      "mathematical_form": "Contradiction(P,¬P) ⇔ same_subject ∧ same_predicate ∧ same_meaning ∧ same_domain ∧ same_time ∧ same_aspect ∧ same_judgment_rank",
      "programming_contract": "ContradictionCheck(check_id, claim_a, claim_b, same_subject, same_predicate, same_meaning, same_domain, same_time, same_aspect, same_judgment_rank, contradiction, residuals)",
      "linguistic_function": "Prevents false contradiction detection across mismatched domains or scopes.",
      "required_inputs": ["domain_assignment", "aspect_scope", "time_scope", "rank_assignment"],
      "outputs": ["contradiction_result"],
      "forbidden_transitions": ["contradiction_without_domain", "contradiction_without_time", "contradiction_without_aspect", "contradiction_without_judgment_rank"],
      "residuals": ["subject_mismatch", "meaning_mismatch", "domain_mismatch", "rank_unaligned"],
      "next_nodes": ["linking"]
    },
    {
      "node_id": "linking",
      "rank": 13,
      "definition": "Produces licensed relation candidates between units or between signal and prior information.",
      "mathematical_form": "L=β(Ui,Uj,K,Γ)→LinkCandidate",